{
  "jsonlogic_shallow_oracle": "vouch.jsonlogic-shallow-oracle/v0",
  "version": "1.3.11",
  "generator": {
    "script": "scripts/check-jsonlogic-shallow-oracle.mjs",
    "seed": "W1.5-jsonlogic-shallow-oracle-0001",
    "mode": "transcription-fidelity-oracle-harness"
  },
  "rules": [
    {
      "rule_id": "jsonlogic-pie-ready",
      "source_system": "JSON Logic",
      "upstream_version": "jsonlogic-operations-subset-v0",
      "upstream_commit_or_container": "not-used-local-rule-json",
      "parameter_data_hashes": [],
      "comparability": "after-declared-map",
      "input_map": "lispex-list-to-json-object/v0",
      "output_map": "jsonlogic-boolean-to-decision/v0",
      "oracle_strength": "documented-example-compatible-local-evaluator",
      "upstream_rule_path": "transcription/jsonlogic-shallow/rules/pie-ready.json",
      "lispex_source_path": "profile-gallery/decision-gallery/cases/jsonlogic-pie-ready.lspx"
    },
    {
      "rule_id": "jsonlogic-required-fields",
      "source_system": "JSON Logic",
      "upstream_version": "jsonlogic-operations-subset-v0",
      "upstream_commit_or_container": "not-used-local-rule-json",
      "parameter_data_hashes": [],
      "comparability": "after-declared-map",
      "input_map": "lispex-list-to-json-object/v0",
      "output_map": "jsonlogic-boolean-to-decision/v0",
      "oracle_strength": "documented-example-compatible-local-evaluator",
      "upstream_rule_path": "transcription/jsonlogic-shallow/rules/required-fields.json",
      "lispex_source_path": "profile-gallery/decision-gallery/cases/jsonlogic-required-fields.lspx"
    }
  ],
  "cases": [
    {
      "case_id": {
        "generator_commit": "585e0ff2b3e841064fa51a777b42f2a4575072b8",
        "seed": "W1.5-jsonlogic-shallow-oracle-0001",
        "index": 0
      },
      "rule_id": "jsonlogic-pie-ready",
      "input_hash": {
        "domain": "csk/profile-input-hash/v0",
        "hex": "939fe9fdf2419f6d66d566a4a24acd1414dca4a78361442a60f8538cde3a9ecf"
      },
      "input_datum": "(-1 \"apple\")",
      "upstream_input": {
        "temp": -1,
        "filling": "apple"
      },
      "upstream_output": true,
      "mapped_upstream_decision": "(decision allow)",
      "lispex_transcript": [
        "(decision allow)"
      ],
      "receipt_comparison_status": "agree",
      "fault_class": null,
      "outcome": "agree",
      "first_divergence": null,
      "cause": null,
      "resolution": null
    },
    {
      "case_id": {
        "generator_commit": "585e0ff2b3e841064fa51a777b42f2a4575072b8",
        "seed": "W1.5-jsonlogic-shallow-oracle-0001",
        "index": 1
      },
      "rule_id": "jsonlogic-pie-ready",
      "input_hash": {
        "domain": "csk/profile-input-hash/v0",
        "hex": "114987c4cc6cfc30ad9fbb1cd2b13f134d3e221ae74dc034e9bcd9bea7d62a26"
      },
      "input_datum": "(-1 \"cherry\")",
      "upstream_input": {
        "temp": -1,
        "filling": "cherry"
      },
      "upstream_output": false,
      "mapped_upstream_decision": "(decision deny wait)",
      "lispex_transcript": [
        "(decision deny wait)"
      ],
      "receipt_comparison_status": "agree",
      "fault_class": null,
      "outcome": "agree",
      "first_divergence": null,
      "cause": null,
      "resolution": null
    },
    {
      "case_id": {
        "generator_commit": "585e0ff2b3e841064fa51a777b42f2a4575072b8",
        "seed": "W1.5-jsonlogic-shallow-oracle-0001",
        "index": 2
      },
      "rule_id": "jsonlogic-pie-ready",
      "input_hash": {
        "domain": "csk/profile-input-hash/v0",
        "hex": "c06d0ab714e4fb68de2d4760a13d7f44fa179c2e0e255a56cce445db753e70bf"
      },
      "input_datum": "(-1 \"pumpkin\")",
      "upstream_input": {
        "temp": -1,
        "filling": "pumpkin"
      },
      "upstream_output": false,
      "mapped_upstream_decision": "(decision deny wait)",
      "lispex_transcript": [
        "(decision deny wait)"
      ],
      "receipt_comparison_status": "agree",
      "fault_class": null,
      "outcome": "agree",
      "first_divergence": null,
      "cause": null,
      "resolution": null
    },
    {
      "case_id": {
        "generator_commit": "585e0ff2b3e841064fa51a777b42f2a4575072b8",
        "seed": "W1.5-jsonlogic-shallow-oracle-0001",
        "index": 3
      },
      "rule_id": "jsonlogic-pie-ready",
      "input_hash": {
        "domain": "csk/profile-input-hash/v0",
        "hex": "c72a739e383cde1125c53f0cc894fda22ace891e601cc3e3146689288becb0c4"
      },
      "input_datum": "(-1 \"\")",
      "upstream_input": {
        "temp": -1,
        "filling": ""
      },
      "upstream_output": false,
      "mapped_upstream_decision": "(decision deny wait)",
      "lispex_transcript": [
        "(decision deny wait)"
      ],
      "receipt_comparison_status": "agree",
      "fault_class": null,
      "outcome": "agree",
      "first_divergence": null,
      "cause": null,
      "resolution": null
    },
    {
      "case_id": {
        "generator_commit": "585e0ff2b3e841064fa51a777b42f2a4575072b8",
        "seed": "W1.5-jsonlogic-shallow-oracle-0001",
        "index": 4
      },
      "rule_id": "jsonlogic-pie-ready",
      "input_hash": {
        "domain": "csk/profile-input-hash/v0",
        "hex": "9c769b1d8249687a73027f29ca70dd99e1134d0004e2cf05b4e9085716a487b8"
      },
      "input_datum": "(-1 \"APPLE\")",
      "upstream_input": {
        "temp": -1,
        "filling": "APPLE"
      },
      "upstream_output": false,
      "mapped_upstream_decision": "(decision deny wait)",
      "lispex_transcript": [
        "(decision deny wait)"
      ],
      "receipt_comparison_status": "agree",
      "fault_class": null,
      "outcome": "agree",
      "first_divergence": null,
      "cause": null,
      "resolution": null
    },
    {
      "case_id": {
        "generator_commit": "585e0ff2b3e841064fa51a777b42f2a4575072b8",
        "seed": "W1.5-jsonlogic-shallow-oracle-0001",
        "index": 5
      },
      "rule_id": "jsonlogic-pie-ready",
      "input_hash": {
        "domain": "csk/profile-input-hash/v0",
        "hex": "156da996a6660e270790ab475d1e2f0eedf685de3e8801812ee03739a225a0d1"
      },
      "input_datum": "(-1 \"apple \")",
      "upstream_input": {
        "temp": -1,
        "filling": "apple "
      },
      "upstream_output": false,
      "mapped_upstream_decision": "(decision deny wait)",
      "lispex_transcript": [
        "(decision deny wait)"
      ],
      "receipt_comparison_status": "agree",
      "fault_class": null,
      "outcome": "agree",
      "first_divergence": null,
      "cause": null,
      "resolution": null
    },
    {
      "case_id": {
        "generator_commit": "585e0ff2b3e841064fa51a777b42f2a4575072b8",
        "seed": "W1.5-jsonlogic-shallow-oracle-0001",
        "index": 6
      },
      "rule_id": "jsonlogic-pie-ready",
      "input_hash": {
        "domain": "csk/profile-input-hash/v0",
        "hex": "9f9cc8873dce762c3c4c94ae956a61a65ebea7997b04e0011f06d78241a8e735"
      },
      "input_datum": "(-1 \"pear\")",
      "upstream_input": {
        "temp": -1,
        "filling": "pear"
      },
      "upstream_output": false,
      "mapped_upstream_decision": "(decision deny wait)",
      "lispex_transcript": [
        "(decision deny wait)"
      ],
      "receipt_comparison_status": "agree",
      "fault_class": null,
      "outcome": "agree",
      "first_divergence": null,
      "cause": null,
      "resolution": null
    },
    {
      "case_id": {
        "generator_commit": "585e0ff2b3e841064fa51a777b42f2a4575072b8",
        "seed": "W1.5-jsonlogic-shallow-oracle-0001",
        "index": 7
      },
      "rule_id": "jsonlogic-pie-ready",
      "input_hash": {
        "domain": "csk/profile-input-hash/v0",
        "hex": "4cfb710c3a08c5f486da12a9c749fa11bce2f54176a518480200afe42ecb0398"
      },
      "input_datum": "(-1 \"banana\")",
      "upstream_input": {
        "temp": -1,
        "filling": "banana"
      },
      "upstream_output": false,
      "mapped_upstream_decision": "(decision deny wait)",
      "lispex_transcript": [
        "(decision deny wait)"
      ],
      "receipt_comparison_status": "agree",
      "fault_class": null,
      "outcome": "agree",
      "first_divergence": null,
      "cause": null,
      "resolution": null
    },
    {
      "case_id": {
        "generator_commit": "585e0ff2b3e841064fa51a777b42f2a4575072b8",
        "seed": "W1.5-jsonlogic-shallow-oracle-0001",
        "index": 8
      },
      "rule_id": "jsonlogic-pie-ready",
      "input_hash": {
        "domain": "csk/profile-input-hash/v0",
        "hex": "a3500a1bbb5a2941c35c196eae5976ed72b3671de4fc08bc64f7138d9b4d2aaa"
      },
      "input_datum": "(0 \"apple\")",
      "upstream_input": {
        "temp": 0,
        "filling": "apple"
      },
      "upstream_output": true,
      "mapped_upstream_decision": "(decision allow)",
      "lispex_transcript": [
        "(decision allow)"
      ],
      "receipt_comparison_status": "agree",
      "fault_class": null,
      "outcome": "agree",
      "first_divergence": null,
      "cause": null,
      "resolution": null
    },
    {
      "case_id": {
        "generator_commit": "585e0ff2b3e841064fa51a777b42f2a4575072b8",
        "seed": "W1.5-jsonlogic-shallow-oracle-0001",
        "index": 9
      },
      "rule_id": "jsonlogic-pie-ready",
      "input_hash": {
        "domain": "csk/profile-input-hash/v0",
        "hex": "eff745c7ac6ded82ff9d9877cd175b73c60d68e669988cfaaaca26c63e1694e2"
      },
      "input_datum": "(0 \"cherry\")",
      "upstream_input": {
        "temp": 0,
        "filling": "cherry"
      },
      "upstream_output": false,
      "mapped_upstream_decision": "(decision deny wait)",
      "lispex_transcript": [
        "(decision deny wait)"
      ],
      "receipt_comparison_status": "agree",
      "fault_class": null,
      "outcome": "agree",
      "first_divergence": null,
      "cause": null,